,content,publish_time,sentiment,1. open,2. high,3. low,4. close,5. volume,day_change,percentage_change,accurate
67,"Tesla Inc. is edging closer to recording its second death cross since September, a bearish signal whereby a stock’s 50-day moving average crosses below the 200-day line. The electric-car maker fell as much as 3.4 percent on Tuesday after the U.S. Securities and Exchange Commission asked a judge to hold Chief Executive Officer Elon Musk in contempt for violating a settlement that required him to get Tesla’s approval before communicating material information to investors.",2019-02-26 00:00:00+00:00,-1,297.91,302.9044,297.0005,298.77,6626522.0,0.8599999999999568,0.002886777885938561,-0.002886777885938561
70,Tesla Inc. shares dropped in Tuesday’s pre-market after the U.S. Securities and Exchange Commission asked a judge to hold Elon Musk in contempt for violating a settlement agreement.,2019-02-26 00:00:00+00:00,-1,297.91,302.9044,297.0005,298.77,6626522.0,0.8599999999999568,0.002886777885938561,-0.002886777885938561
69,Tesla Inc. reported earnings that fell short of analysts’ estimates as Chief Executive Officer Elon Musk cuts jobs to keep the electric-car maker profitable.,2019-01-30 00:00:00+00:00,-1,295.27,298.5566,291.8,297.46,4621692.0,2.1899999999999977,0.007416940427405419,-0.007416940427405419
88,Being a Tesla Inc. shareholder has required a strong stomach over the past year as the stock price routinely posted double-digit price swings from one month to the next. Now options investors are bracing for even more volatility in the wake of the company’s earnings report.,2019-01-30 00:00:00+00:00,1,295.27,298.5566,291.8,297.46,4621692.0,2.1899999999999977,0.007416940427405419,0.007416940427405419
71,"Tesla Inc. could soon become more German, if Morgan Stanley’s prediction is right.",2019-11-07 00:00:00+00:00,0,318.0,326.72,314.5,326.58,7940932.0,8.579999999999984,0.026981132075471648,0.0
72,"Tesla Inc.’s manic year of production took its toll on workers. Staff at the automaker’s lone assembly plant in Fremont, California, spent almost three times as many days off the job because of work-related injuries and illness in 2018 as the year before, an indication of just how much strain they were under as they manufactured electric cars at scale for the first time. When taking headcount growth into account, the amount of time away per worker doubled last year, according to Tesla’s report t",2019-03-19 00:00:00+00:00,0,276.0,278.05,267.3,269.49,10280980.0,-6.509999999999991,-0.0235869565217391,-0.0
74,"Tesla Inc.’s home state of California accounted for almost half of all Model 3 registrations through the first 10 months of 2018, a sign that the electric-car maker is wildly popular in the Golden State but not yet ubiquitous in other parts of the country.",2019-01-16 00:00:00+00:00,1,335.0,348.8,334.5,344.43,6056590.0,9.430000000000007,0.028149253731343304,0.028149253731343304
75,"As Tesla Inc.’s tumultuous first quarter draws to an end, another Wall Street analyst cautioned that the company’s vehicle deliveries for the period may disappoint.",2019-03-25 00:00:00+00:00,-1,272.58,272.8,264.0,264.53,8745609.0,-8.050000000000011,-0.029532614278377035,0.029532614278377035
78,"Tesla Inc. shares plunged 5 percent Friday, the worst rout for the stock following one of Chief Executive Officer Elon Musk’s parties to hype a new product or service.",2019-03-15 00:00:00+00:00,-1,292.45,295.39,288.29,289.96,7103447.0,-2.490000000000009,-0.008514275944605947,0.008514275944605947
79,Tesla Inc.’s recent progress in a few key initiatives while showing increased efficiency in fulfilling its global order book -- all in a relatively quiet manner -- is music to the ears of one analyst.,2019-09-03 00:00:00+00:00,1,229.15,232.44,224.213,225.61,9327775.0,-3.539999999999992,-0.015448396246999747,-0.015448396246999747
91,Tesla Inc.’s plunging stock price indicates investors want Elon Musk to quickly cut a deal with the Securities and Exchange Commission. The question is whether the notoriously unpredictable chief executive officer will take the hint.,2018-09-28 00:00:00+00:00,0,312.9,314.96,306.91,307.52,8509084.0,-5.3799999999999955,-0.017193991690635974,-0.0
93,A bipartisan group of senators introduced legislation Wednesday that would extend a lucrative tax credit for electric vehicles that could benefit companies like Tesla Inc. and General Motors Co.,2019-04-10 00:00:00+00:00,1,271.65,275.0,269.61,272.31,5904031.0,0.660000000000025,0.002429596907785846,0.002429596907785846
94,"Tesla Inc. shares rebounded from last week’s U.S. lawsuit over Elon Musk’s take-private tweets, as a settlement ensured the billionaire will keep calling the shots at the carmaker he’s said is on the verge of profitability.",2018-10-01 00:00:00+00:00,-1,270.26,278.0,260.56,264.77,33649700.0,-5.490000000000009,-0.02031377192333312,0.02031377192333312
96,"Elon Musk may be starting to put those take-private tweets behind him, but his fortune will need more time to recover.",2018-10-01 00:00:00+00:00,0,270.26,278.0,260.56,264.77,33649700.0,-5.490000000000009,-0.02031377192333312,-0.0
95,"Tesla fell 1.7 percent pre-market Tuesday, after Morgan Stanley forecast “an air pocket in demand that is coming earlier than we expected,” and cut its price target on the electric-vehicle maker to $260 from $283.",2019-03-12 00:00:00+00:00,-1,283.52,291.28,280.5,290.92,7392278.0,7.400000000000034,0.026100451467268745,-0.026100451467268745
97,"Tesla may qualify to be included in the S&P 500 Index in the second quarter of next year, Macquarie analyst Maynard Um wrote in a note to clients. That is, if it manages to show sustained profitability over trailing 12 months.",2018-11-08 00:00:00+00:00,0,343.34,351.18,340.8,348.16,7374522.0,4.82000000000005,0.014038562358012612,0.0
98,"The world’s biggest lithium-ion battery is about to get even bigger, with Tesla Inc. set to beef up capacity at the Hornsdale site in South Australia.",2019-11-19 00:00:00+00:00,0,352.9165,353.15,346.1,349.99,4408505.0,-2.926499999999976,-0.008292329772056494,-0.0
99,"Tesla Inc. sinks as much as 4.7 percent, briefly dipping below $300 a share, as questions about the profitability of its Model 3 linger even after the electric carmaker met its production goal of building 5,000 units a week.",2018-07-05 00:00:00+00:00,1,331.75,332.49,309.69,310.86,12282638.0,-20.889999999999986,-0.06296910324039182,-0.06296910324039182
